{
  "action": {
    "subject": {
      "challenge_checkpoint": {
        "domain": "accepted-checkpoint-height",
        "value": 5
      },
      "challenge_state": "OPEN",
      "covenant_hash": "sha256:f45645e91c063000e8120effa3af63b8238f459c22aab26bdb6bf29d5fb067f5",
      "covenant_id": "witness-covenant-001",
      "finding_class": "SAME_SIZE_LOG_EQUIVOCATION",
      "finding_ref": "sha256:b23fa8685724fa10f2b15ed454d59824f1430d1cd7e1d1a33dc1c88abffb5fed",
      "issuer_role": "challenge_authority",
      "observed_checkpoint": 4,
      "prior_challenge_ref": null,
      "profile": "bulla.witness-covenant/0.1-experimental"
    },
    "type": "assurance.challenge.state"
  },
  "anchor_ref": {},
  "authorization": {
    "issuer": "did:key:z6Mkqc3NoHiAzQ1gHMZXNcRg97tE2EKAb6kCcFoK1Sx4J2VW",
    "proofValue": "gPZJ0TqYGkeH3c9OHa+FjLg24E5T5tTGFRzZirbZ0sX2F8KZWvNGw7SOQQzN9pFOtjZoyW2RXyPwjIwbxIzXCQ==",
    "purpose": "authorization",
    "type": "bulla/ed25519-2026",
    "verificationMethod": "did:key:z6Mkqc3NoHiAzQ1gHMZXNcRg97tE2EKAb6kCcFoK1Sx4J2VW"
  },
  "canonicalization": "bulla-jcs-int/1",
  "claimed_at": "2026-08-21T12:02:00Z",
  "conventions": [],
  "diagnostic_ref": {
    "status": "not_applicable"
  },
  "event_id": "c5f4b09c-f69b-4bfd-9c06-91f749dc5c05",
  "evidence_refs": [],
  "hashes": {
    "attestation": "sha256:728edc5c4cd54fc520044a9bf5838b3bd2ca5060fabff6bd17ba1f61609c0edf",
    "content": "sha256:b25b0d9f9688173cccc4dec10654e73fb6473c4ffe1efea95552489b300ab548",
    "event": "sha256:f3c3fe6908e7e41b3ad7a351c04bfa460635c834307cda1bf8eebbd1d52ed866",
    "log_leaf": "sha256:d6f87bf6a7eca4c1ba8d51635f869ae957a77f974ae432f5a16174b0f2e18b94"
  },
  "kind": "action_receipt",
  "mandate": {
    "authority": {
      "delegation": [],
      "policy": "policy://witness-covenant/assurance.challenge.state",
      "principal": "did:key:z6Mkqc3NoHiAzQ1gHMZXNcRg97tE2EKAb6kCcFoK1Sx4J2VW"
    },
    "bounds": {
      "scope": "profile:bulla.witness-covenant/0.1-experimental"
    }
  },
  "occurrence": {
    "issuer": "did:key:z6Mkqc3NoHiAzQ1gHMZXNcRg97tE2EKAb6kCcFoK1Sx4J2VW",
    "proofValue": "DKiTng3oTWGuc8kf96v2IESamX3WRAUhF2pECbbm6RjmkixmgUwh5AXwilDTSrkgTdgb+KhMHAWaObMi06VpAA==",
    "purpose": "occurrence",
    "type": "bulla/ed25519-2026",
    "verificationMethod": "did:key:z6Mkqc3NoHiAzQ1gHMZXNcRg97tE2EKAb6kCcFoK1Sx4J2VW"
  },
  "producer": {
    "bulla_version": "source",
    "fixture": "witness-covenant-v0.1"
  },
  "remedy": {
    "challenge_window": "checkpoint:witness-covenant-5",
    "forum": {
      "log_endpoint": "https://glyphstandard.com/bulla/answerable-computing",
      "trusted_root_ref": "sha256:da1419fd390257586cf05c3f0204131897f6f240145df908f6a2cffca581b069"
    },
    "remedies": [
      {
        "anchor": "forum:witness-covenant",
        "rung": "challenge",
        "verifier": "verify the covenant dossier under separately supplied trust roots"
      }
    ]
  },
  "retention": {
    "disclosure": "public",
    "record": "operational"
  },
  "schema_version": "0.4",
  "signature": {
    "issuer": "did:key:z6Mkqc3NoHiAzQ1gHMZXNcRg97tE2EKAb6kCcFoK1Sx4J2VW",
    "proofValue": "ubMLVLqgEkF6JrgbOtEY2LduSNfO2qhmCOfV6ZrYht6nHkUc5UqiHrrUGXXQiRBMeOvsjYwcgnGpF19Zt4MHDw==",
    "purpose": "content",
    "type": "bulla/ed25519-2026",
    "verificationMethod": "did:key:z6Mkqc3NoHiAzQ1gHMZXNcRg97tE2EKAb6kCcFoK1Sx4J2VW"
  },
  "stake": null
}
